{
  "ns": "anthropic",
  "name": "claude-api",
  "title": "Claude Messages API",
  "tagline": "Anthropic Messages API with tool use and prompt caching.",
  "category": "ai",
  "verified": true,
  "official": true,
  "featured": false,
  "trending": true,
  "downloads": 118203,
  "stars": 1442,
  "requests": 28,
  "version": "2026.02",
  "updated": "4d ago",
  "langs": ["REST", "Streaming"],
  "color": "#d97757",
  "source": { "type": "git", "repo": "https://github.com/anthropics/anthropic-sdk-typescript", "subdir": ".", "ref": "main" }
}
